{
  "compatibility": {
    "conformance_profile_version": "0.2.0",
    "controller_protocol_versions": [
      "0.3.0"
    ],
    "element_model_versions": [
      "0.2.0"
    ]
  },
  "contract_version": "0.2.0",
  "data_classification": "reusable_non_case",
  "dataset_versions": {
    "attack_angles": "0.1.1",
    "authorities": "0.1.0",
    "deadlines": "0.1.0",
    "operations": "0.1.0",
    "routes": "0.1.0",
    "rules": "0.1.0",
    "sources": "0.1.0"
  },
  "destination_state_profiles_available": [
    "SE"
  ],
  "freshness_state": "baseline_verified_not_live_rechecked",
  "id_namespace": "tr",
  "jurisdiction": "TR",
  "known_gap_ids": [
    "tr:gap:live-channel",
    "tr:gap:mission-competence",
    "tr:gap:non-sweden-profiles"
  ],
  "module_family": "applicant_country",
  "module_id": "applicant-country-tr-sweden-pilot",
  "module_version": "0.1.1",
  "pack_version": "0.1.0",
  "supported_domains": [
    "mission_operations",
    "turkish_civil_documents",
    "passport_access",
    "local_visa_appointment"
  ],
  "supported_roles": [
    "application_context",
    "mission_context"
  ]
}
