{
  "contract_version": "0.2.0",
  "module_family": "member_state",
  "module_id": "member-state-se",
  "jurisdiction": "SE",
  "module_version": "0.1.0",
  "pack_version": "0.1.0",
  "freshness_state": "current",
  "supported_domains": [
    "procedure"
  ],
  "dataset_versions": {
    "sources": "0.1.0",
    "rules": "0.1.0",
    "authorities": "0.1.0",
    "deadlines": "0.1.0",
    "routes": "0.1.0",
    "operations": "0.1.0",
    "attack_angles": "0.1.0"
  },
  "id_namespace": "se",
  "supported_roles": [
    "deciding_state",
    "residence_state"
  ],
  "compatibility": {
    "conformance_profile_version": "0.2.0",
    "controller_protocol_versions": [
      "0.3.0"
    ],
    "element_model_versions": [
      "0.2.0"
    ]
  },
  "data_classification": "reusable_non_case",
  "known_gap_ids": []
}
